{
    "$schema": "http://json-schema.org/draft-07/schema#",
    "$id": "https://a2v10.com/schemas/metadata-report-json-schema.json",
    "title": "A2v10 metadata.json (report)",
    "description": "A report: a window into a surface, no data of its own. Declares the SUBSET that may be asked, not a query - the client picks one inside it at runtime. surface >= subset >= query: the first is checked at build, the second at runtime. Not here: SQL, presentation, captions, the user's saved choice. Irregular report -> eject to a handler. Enum values are PascalCase.",
    "type": "object",
    "additionalProperties": false,
    "required": [ "type", "surface" ],
    "properties": {
        "$schema": { "type": "string" },
        "description": { "type": "string", "description": "For the model, not the platform: nothing reads it - no generator, runtime or deploy. Where the model writes down what it must know about this endpoint - its rules and the reasons for them - so the next session finds them here." },
        "type": {
            "description": "Form of the answer. One today: 'turnover' - opening balance, movements of the period, closing balance.",
            "type": "string",
            "enum": [ "turnover" ]
        },
        "surface": {
            "type": "string",
            "description": "Journal this report reads, e.g. '/journal/stock'. Not 'table' or 'storage': a report owns no rows and inherits no declaration."
        },
        "groups": {
            "description": "Dimensions offered for grouping, resolved into the surface at build. Order here is order in the taskpad - there is no 'order' key.",
            "type": "array",
            "items": { "type": "string" }
        },
        "filters": {
            "description": "Dimensions offered for filtering. Resolved and ordered as 'groups'.",
            "type": "array",
            "items": { "type": "string" }
        },
        "data": {
            "description": "Measures offered for display, resolved into the surface at build.",
            "type": "array",
            "items": { "type": "string" }
        },
        "defaults": {
            "description": "Ticked on open. Each name repeats one from the list it belongs to; absent there - refused at build. No 'filters' here: a filter opens empty.",
            "type": "object",
            "additionalProperties": false,
            "properties": {
                "groups": {
                    "type": "array",
                    "items": { "type": "string" }
                },
                "data": {
                    "type": "array",
                    "items": { "type": "string" }
                }
            }
        }
    }
}
